p_cate,p_name,p_price,p_rating,s_name,s_rating
Bếp & Phòng ăn,Hộp quà bí ẩn,34.500 ₫,,shishang9,
Giày dép & Quần áo nam,DIRTYCOINS Graffitee T-shirt,350.000 ₫,,Dirty Coins,
Giày dép & Quần áo nam,[HCM][Voucher 10%] Áo thun Teeworld Saigonese - The City That Never Sleeps T-shirt,201.000 ₫,,Teeworld Fashion - Thế Giới Áo Thun,
Văn phòng phẩm và nghề thủ công,Hộp quà bí ẩn-Tri ân khách hàng- tặng 1 hộp quà- Qùa tặng CHAMY,9.350 ₫,,Chamy,
Điện thoại & Máy tính bảng,Điện thoại Iphone X 64g - 256g quốc tế mới 98%,4.444.310 ₫,,ShopcongngheHT,
